{
  "schemaVersion": "1.0.0",
  "runId": "run-res-020-20260817-omega-xv-absorption-frontier",
  "checkedAt": "2026-08-17T14:00:00Z",
  "status": "REUNDERWRITE_EXISTING_NOT_CANONICAL_PROMOTION",
  "records": [
    {
      "frontierId": "af-permit-echo",
      "ideaRef": "PermitEcho",
      "candidateRef": null,
      "noveltyDistance": "EXISTING_IDEA_REUNDERWRITE",
      "naturalAbsorbers": ["authority permitting portals", "permitting consultants", "developer project-control systems", "document-management suites"],
      "absorptionMechanisms": ["official digital submission", "consultant-owned reconciliation", "project-system document retention"],
      "absorptionPressure": 78,
      "controlPointDistance": "MULTI_SYSTEM",
      "residualWork": ["reconstructing conflicting permit evidence across parties", "version and responsibility handoff ledger", "exception packet for a reviewer who did not create the source file"],
      "residualBuyer": "industrial developer or permitting consultant with a live disputed evidence package",
      "failureEvidence": ["Generic permit submission is already absorbed; no buyer, dataset, or paid pilot is recorded for the reconciliation wedge."],
      "opportunityHalfLife": "structural, but validation window is one live disputed project",
      "verdict": "RETAIN_FOR_VALIDATION",
      "promotionEligible": false,
      "sourceRefs": ["s314", "s96"],
      "confidence": "medium"
    },
    {
      "frontierId": "af-pid-relay",
      "ideaRef": "PIDRelay",
      "candidateRef": null,
      "noveltyDistance": "EXISTING_IDEA_REUNDERWRITE",
      "naturalAbsorbers": ["customs brokers", "marketplaces and seller portals", "ERP/PIM suites", "logistics and trade-compliance platforms"],
      "absorptionMechanisms": ["catalog master-data onboarding", "broker pre-clearance service", "platform-required product identifiers"],
      "absorptionPressure": 86,
      "controlPointDistance": "MULTI_SYSTEM",
      "residualWork": ["supplier-side identity recovery when the importer lacks authority", "multi-source exception reconciliation before a shipment or listing decision", "evidence of why a proposed PID is not safe to reuse"],
      "residualBuyer": "private-label importer or multi-supplier seller facing a real blocked SKU or shipment",
      "failureEvidence": ["Generic PID lookup and customs catalog tooling are natural absorber territory; the existing research receipt records no payment or independent validation."],
      "opportunityHalfLife": "short regulatory half-life; validate before broker/marketplace absorption closes the gap",
      "verdict": "REUNDERWRITE_NARROWLY",
      "promotionEligible": false,
      "sourceRefs": ["s315", "s96"],
      "confidence": "medium"
    },
    {
      "frontierId": "af-machine-change",
      "ideaRef": "MachineChange",
      "candidateRef": null,
      "noveltyDistance": "EXISTING_IDEA_REUNDERWRITE",
      "naturalAbsorbers": ["PLM/QMS systems", "ERP change-control modules", "industrial compliance suites", "machine and supplier portals"],
      "absorptionMechanisms": ["controlled engineering change workflows", "supplier notice intake", "asset master-data propagation"],
      "absorptionPressure": 72,
      "controlPointDistance": "MULTI_SYSTEM",
      "residualWork": ["independent reconstruction of change impact across organisations", "evidence-debt ledger for old machine states", "exception ownership when no system is authoritative"],
      "residualBuyer": "operator or independent assessor with a cross-system change dispute",
      "failureEvidence": ["A generic change-management product would be absorbed by existing PLM/QMS/ERP; the residual claim is only the independent cross-system evidence layer."],
      "opportunityHalfLife": "structural; opportunity depends on a reachable dispute owner",
      "verdict": "RETAIN_FOR_VALIDATION",
      "promotionEligible": false,
      "sourceRefs": ["s316", "s96"],
      "confidence": "low"
    },
    {
      "frontierId": "af-cra-attestation",
      "ideaRef": "CRA Clock",
      "candidateRef": null,
      "noveltyDistance": "EXISTING_IDEA_UPGRADE",
      "naturalAbsorbers": ["CRA Single Reporting Platform", "product-security teams", "SBOM/build pipeline tooling", "incident-response providers"],
      "absorptionMechanisms": ["single official reporting route", "security evidence generated in CI/CD", "managed incident response"],
      "absorptionPressure": 91,
      "controlPointDistance": "ONE_STEP",
      "residualWork": ["independent completeness and provenance check before filing", "cross-version evidence packet when build and incident systems disagree"],
      "residualBuyer": "manufacturer preparing a high-consequence CRA report",
      "failureEvidence": ["The official SRP is operationally targeted for 11 September 2026 and functional/security testing is underway; a generic CRA uploader is therefore excluded."],
      "opportunityHalfLife": "deadline-shaped; re-underwrite only as an evidence-integrity challenger",
      "verdict": "WATCH",
      "promotionEligible": false,
      "sourceRefs": ["s314", "s315"],
      "confidence": "high"
    }
  ]
}
